level,lang,suggestion
high,french,"Très élevé ! Faites une pause, respirez profondément et organisez vos tâches."
high,french,"Stress élevé ! Prenez quelques minutes pour méditer ou marcher."
high,english,"High stress! Take a short break, breathe deeply and organize your tasks."
high,english,"Feeling stressed! Try a brief meditation or walk."
high,arabic,"ضغط عالي! خذ استراحة قصيرة وتنفس بعمق ونظم مهامك."
high,arabic,"تشعر بالتوتر؟ حاول أن تأخذ استراحة قصيرة وتمارس التنفس العميق."
medium,french,"Modéré. Prenez un moment pour vous reposer et vous détendre."
medium,english,"Moderate stress. Take a moment to rest and relax."
medium,arabic,"ضغط متوسط. خذ لحظة للراحة والاسترخاء."
low,french,"Faible. Continuez à maintenir votre calme et votre équilibre."
low,english,"Low stress. Keep up your calm and balance."
low,arabic,"ضغط منخفض. حافظ على هدوئك وتوازنك."
high,arabic,"ضغط مرتفع. خذ استراحة قصيرة وتنفس بعمق."
high,darija_lat,"Stress tale3 bezaf. khod pause sghira w tnefass mzyan."
high,english,"High stress indicators detected based on linguistic and emotional feature analysis. Immediate cognitive load reduction is recommended."
high,english,"The model identifies elevated stress probability. Short-term disengagement and breathing regulation are advised."
high,english,"Textual patterns suggest acute stress. Temporary task interruption may improve emotional regulation."
high,english,"Stress classification output exceeds critical threshold. Rest and reduced stimulation are recommended."
high,french,"Des indicateurs linguistiques montrent un stress élevé. Une réduction immédiate de la charge mentale est conseillée."
high,french,"Le modèle prédit un niveau de stress critique. Une pause et une régulation respiratoire sont recommandées."
high,french,"L’analyse du texte révèle une tension émotionnelle importante. Il est conseillé de ralentir le rythme."
high,french,"Un seuil élevé de stress a été atteint selon la classification automatique."
high,arabic,"أظهر التحليل اللغوي مستوى توتر مرتفع. يُنصح بتقليل العبء الذهني فورًا."
high,arabic,"تشير نتائج النموذج إلى إجهاد نفسي حاد. أخذ استراحة قصيرة ضروري."
high,arabic,"تم تجاوز عتبة التوتر المحددة خوارزميًا. يُفضل تقليل المحفزات."
high,darija_lat,"Ela hasab lmo3alaja loghawiya, kayn ijhad nafsi qwi"
medium,english,"Moderate stress probability detected. Improved task organization may prevent escalation."
medium,english,"Stress level remains manageable according to model output. Preventive breaks are advised."
medium,english,"Linguistic features indicate moderate emotional strain."
medium,french,"Le niveau de stress est modéré selon l’analyse. Une meilleure gestion des tâches est recommandée."
medium,french,"Les résultats indiquent un stress contrôlable. Des pauses préventives peuvent aider."
medium,french,"Une tension émotionnelle moyenne a été identifiée."
medium,arabic,"تشير النتائج إلى توتر متوسط يمكن التحكم فيه."
medium,arabic,"مستوى الضغط النفسي متوسط حسب النموذج."
medium,darija_lat,"Kayn stress mtweset ela hsab tahlil, khasek ghir tnedem lkhadma dyalk ."
low,english,"Low stress classification detected. Current behavioral patterns appear stable."
low,english,"The model predicts minimal stress impact. No corrective action is required."
low,french,"Un faible niveau de stress a été détecté. السلوك الحالي متوازن."
low,french,"Les indicateurs montrent une stabilité émotionnelle."
low,arabic,"تم تصنيف مستوى التوتر على أنه منخفض."
low,arabic,"الحالة النفسية مستقرة حسب التحليل."
low,darija_lat,"Stress d3if ela hasab hdertek , koulshi mezian daba !"
low,darija_lat,"Makayn hta shi daght mohim ola ktir daba fhad lmarhala ."
high,darija_lat,"Bayn elik deght.hawl trtah shwiya o ndem khdemtek."
high,darija_lat,"Rak 3yan bezaf. wqef shwiya o khoud lik nafas 3amiq ."
high,darija_ar,"الستريس طالع بزاف. خد واحد الوقفة ونفس مزيان."
high,darija_ar,"باين عليك مضغوط. حاول ترتاح شوية وتنظم خدمتك."
high,darija_ar,"راك تعبان بزاف. وقف شوية وخد نفس عميق."
high,mixed,"Stress élevé بزاف! prends une pause w tnfass mzyan."
high,mixed,"Rak stressed بزاف, try to relax and breathe slowly."
high,mixed,"ستريس طالع! Take a break و ريّح راسك."
medium,english,"Moderate stress. Take a moment to relax and slow down."
medium,french,"Stress modéré. Prenez un moment pour vous détendre."
medium,arabic,"ضغط متوسط. خذ لحظة للاسترخاء."
medium,darija_lat,"Stress mtweset. Hawl theden shwiya o dir wahd lpause."
medium,darija_lat,"Rak mqeleq shwiya. ndem wqtek o rye7 rask ."
medium,darija_lat,"Mashi khatir. khod wahd lbreak o kml khdemtek."
medium,darija_ar,"الستريس متوسط. حاول تهدا شوية."
medium,darija_ar,"راك مقلق شوية. نظم وقتك و ريّح راسك."
medium,darija_ar,"الوضع متحكم فيه. خد استراحة قصيرة."
medium,mixed,"Stress moyen, prends une pause et relax."
medium,mixed,"Rak un peu stressed, try to organize your time."
medium,mixed,"ضغط متوسط. Stay calm و كمل خدمتك."
low,english,"Low stress level. Keep maintaining your calm and balance."
low,french,"Stress faible. Continuez à maintenir votre calme."
low,arabic,"ضغط منخفض. حافظ على هدوئك."
low,darija_lat,"Stress habet. Kemel haka o hafed ela tawazon dyalk ."
low,darija_lat,"Rak ghadi mezian . kemel bnefs tariqa dlkhdma ."
low,darija_lat,"koulshi mezian. Hafed ela lhodoue dyalk."
low,darija_ar,"الستريس هابط. حافظ على هدوئك."
low,darija_ar,"راك مرتاح. كمل بنفس الطريقة."
low,darija_ar,"كلشي مزيان. خليك متوازن."
low,mixed,"Low stress,stay calm , o kemel haka."
low,mixed,"راك مرتاح. Keep this balance."
low,mixed,"ضغط ضعيف. Enjoy و كمل بهدوء."
high,english,"You are feeling overwhelmed. Try grounding yourself by focusing on your breathing."
high,english,"High emotional pressure detected. Step back and give yourself permission to rest."
high,english,"Stress is intense. Reducing screen time may help you calm down."
high,english,"You may be overloaded. Break your tasks into smaller steps."
high,english,"Strong stress signals detected. A few minutes of silence can help."
high,french,"Vous êtes submergé par le stress. Prenez un instant pour ralentir."
high,french,"Une forte pression émotionnelle est détectée. Accordez-vous du repos."
high,french,"Stress intense. Réduire le temps d’écran peut aider."
high,french,"Vous semblez dépassé. Divisez vos tâches en petites étapes."
high,french,"Un niveau de stress élevé est détecté. Le calme peut vous aider."
high,arabic,"يبدو أنك تحت ضغط كبير. حاول التركيز على تنفسك."
high,arabic,"توتر شديد ملحوظ. امنح نفسك بعض الراحة."
high,arabic,"تشعر بإرهاق كبير. تقليل الشاشات قد يساعد."
high,arabic,"الضغط مرتفع. قسم مهامك إلى خطوات صغيرة."
high,arabic,"إشارات توتر قوية. لحظات الهدوء قد تكون مفيدة."
high,darija_lat,"Dght qwi. 3ti lrassk l7eq tertah chwia."
high,darija_lat,"Rah eandek bezef maydar,nqess shwiya men tele."
high,darija_lat,"Lkhedma ktira eandek.Hawel tqesemha shwiya bshwiya o sebeq li mohim hwa lwel..."
high,darija_lat,"Tawatour kbir. Skat chwiya i9der y3awnek."
high,darija_ar,"راك عامر بالستريس. ركز على تنفسك."
high,darija_ar,"ضغط قوي. عطي راسك حق الراحة."
high,darija_ar,"راك مشغول بزاف. نقص شوية من الهاتف."
high,darija_ar,"الخدمة كترة. قسمها خطوة بخطوة."
high,darija_ar,"توتر كبير. الهدوء شوية يعاون."
high,mixed,"High pressure detected. خد pause و ركز على التنفس."
high,mixed,"Rak overwhelmed, prends du repos شوية."
high,mixed,"Stress قوي. Reduce screen time و ريّح راسك."
high,mixed,"Too much stress. قسم tasks ديالك."
high,mixed,"ضغط كبير. Silence شوية يساعد."
medium,english,"You may feel some pressure. Take a short pause to reset."
medium,english,"Stress is present but manageable. Stay organized."
medium,english,"You seem slightly tense. Gentle breathing can help."
medium,english,"Moderate stress detected. Balance effort and rest."
medium,english,"Take care of yourself and slow your pace."
medium,french,"Une certaine pression est présente. Faites une pause."
medium,french,"Stress modéré. Essayez de rester organisé."
medium,french,"Vous êtes un peu tendu. Respirez calmement."
medium,french,"Stress moyen détecté. Équilibrez effort et repos."
medium,french,"Prenez soin de vous et ralentissez."
medium,arabic,"تشعر ببعض الضغط. خذ استراحة قصيرة."
medium,arabic,"الضغط موجود لكنه قابل للتحكم."
medium,arabic,"توتر خفيف. التنفس الهادئ قد يساعد."
medium,arabic,"ضغط متوسط. وازن بين الجهد والراحة."
medium,arabic,"اعتنِ بنفسك وخفف الوتيرة."
medium,darija_lat,"Eandek stress mtweset.Nedem khdemtk shwiya."
medium,darija_lat,"Lwed3 dyalk mthekem fih . Wazen mabin lkhedma o ra7a ."
medium,darija_lat,"Kayban li thbess shwiya ead tkmel bash tkhli tawazoun ."
medium,darija_ar,"كاين شوية ضغط. خد وقفة قصيرة."
medium,darija_ar,"الستريس متوسط. نظم خدمتك."
medium,darija_ar,"راك مشدود شوية. نفس بهدوء."
medium,darija_ar,"الوضع متحكم فيه. وازن بين الخدمة والراحة."
medium,darija_ar,"هدا شوية و كمل."
medium,mixed,"Moderate stress, دير pause و رجع بهدوء."
medium,mixed,"Rak un peu tendu, breathe slowly."
medium,mixed,"ضغط متوسط. Stay organized و كمل."
medium,mixed,"Some stress is normal. خليك calm."
medium,mixed,"Balance work و rest."
low,english,"You are doing well. Keep this steady rhythm."
low,english,"Stress appears low. Continue your healthy habits."
low,english,"You seem calm and balanced."
low,english,"Low tension detected. Enjoy the moment."
low,english,"Everything looks stable. Keep going."
low,french,"Vous allez bien. Gardez ce rythme."
low,french,"Le stress est faible. Continuez vos bonnes habitudes."
low,french,"Vous semblez calme et équilibré."
low,french,"Peu de tension détectée. Profitez du moment."
low,french,"Tout est stable. Continuez ainsi."
low,arabic,"تبدو بحالة جيدة. استمر على هذا النسق."
low,arabic,"التوتر منخفض. حافظ على عاداتك الجيدة."
low,arabic,"تبدو هادئًا ومتوازنًا."
low,arabic,"توتر ضعيف. استمتع باللحظة."
low,arabic,"كل شيء مستقر. واصل."
low,darija_ar,"راك مزيان. كمل بنفس الوتيرة."
low,darija_ar,"الستريس هابط. حافظ على عاداتك."
low,darija_ar,"راك هادئ ومتوازن."
low,darija_ar,"توتر ضعيف. استمتع بالوقت."
low,darija_ar,"كلشي مستقر. كمل."
low,mixed,"Low stress, keep this rhythm."
low,mixed,"راك calm. Continue هكذا."
low,mixed,"Everything is fine. Enjoy the balance."
low,mixed,"ضغط ضعيف. Stay positive."
low,mixed,"You’re doing well. كمل."
high,english,"You seem overwhelmed. Pause for a moment, breathe slowly, and focus on one task at a time."
high,french,"Vous semblez dépassé(e). Respirez calmement et concentrez-vous sur une seule tâche."
high,arabic,"يبدو أنك تحت ضغط كبير. توقف قليلاً وخذ أنفاساً عميقة."
high,darija_lat,"Bayna fik measeb bezef. Khod nafass mezian , rteb afkark, o rekez mezian ."
high,darija_ar,"باين عليك مضغوط بزاف، وقف شوية وخد النفس وركّز على حاجة وحدة."
high,mixed,"Stress high! وقف شوية، breathe deeply و رجّع تركيزك."
medium,english,"Moderate stress detected. Take a short break and stretch your body."
medium,french,"Stress modéré. Faites une courte pause et détendez votre corps."
medium,arabic,"ضغط متوسط. خذ استراحة قصيرة وحرك جسمك."
medium,darija_lat,"stress mtwesset eandek,khoud stiraha o herek ljism dyal , khrej , dir sport , koul shi haja healthy.."
medium,darija_ar,"الضغط متوسط، دير بريك صغير وحرّك جسمك."
medium,mixed,"Stress medium، دير pause قصيرة و relax شوية."
low,english,"Low stress level. Keep maintaining healthy habits and balance."
low,french,"Niveau de stress faible. Continuez à maintenir de bonnes habitudes."
low,arabic,"مستوى الضغط منخفض. استمر في الحفاظ على توازنك."
low,darija_ar,"الضغط ضعيف، كمّل هكا و حافظ على التوازن ديالك."
low,mixed,"Low stress، keep going و دير نفس الروتين الزوين."
high,english,"Your stress is very high. Disconnect for a few minutes and slow your breathing."
high,french,"Votre niveau de stress est très élevé. Déconnectez-vous quelques minutes et respirez lentement."
high,arabic,"مستوى التوتر مرتفع جداً. ابتعد قليلاً وخفف من سرعة تنفسك."
high,darija_lat,"stress tal3 bezef.B3ed elik tele shwiya o khoud wahd tanafouss bshwiya ."
high,darija_ar,"الستريس طالع بزاف، حبّس شوية، بعد على التليفون وخد النفس بشوية."
high,mixed,"High stress! حبّس شوية و ركّز غير على التنفس ديالك."
medium,english,"You are experiencing some stress. Try listening to calm music or taking a short walk."
medium,french,"Vous ressentez un certain stress. Essayez d'écouter de la musique calme ou de marcher un peu."
medium,arabic,"تشعر ببعض التوتر. حاول الاستماع إلى موسيقى هادئة أو المشي قليلاً."
medium,darija_lat,"Kayn shwiya dyal stress, sme3 shwiya music had2a ola khrej dour shwiya ."
medium,darija_ar,"كاين شوية ستريس، سمع شي موسيقى هادئة ولا خرج دُوّر شوية."
medium,mixed,"Stress medium، سمع music هادئة ولا خرج تمشى شوية."
low,english,"Everything seems under control. Keep taking care of yourself."
low,french,"Tout semble sous contrôle. Continuez à prendre soin de vous."
low,arabic,"الأمور تبدو جيدة. استمر في العناية بنفسك."
low,darija_lat,"lomor meziana . kemel o thela frasek."
low,darija_ar,"الأمور مزيانة، كمّل تهلا فـ راسك."
low,mixed,"Low stress، الأمور مزيانة، keep it up."
high,english,"You may be feeling overloaded. Stop, ground yourself, and focus on the present moment."
high,french,"Vous semblez surchargé(e). Arrêtez-vous, recentrez-vous et vivez le moment présent."
high,arabic,"قد تشعر بإرهاق شديد. توقف وركز على اللحظة الحالية."
high,darija_ar,"راك معبّي بزاف، وقف دابا و ركّز غير فهاد اللحظة."
high,mixed,"Stress high، وقف دابا و ركّز على اللحظة present."
medium,english,"Some stress is present. Write down what worries you and prioritize calmly."
medium,french,"Un peu de stress est présent. Notez vos préoccupations et classez-les calmement."
medium,arabic,"هناك بعض التوتر. اكتب ما يقلقك ورتب أولوياتك بهدوء."
medium,darija_lat,"Kayn shwiya stress.Kteb shnou mqelqek o reteb lawlawiyat."
medium,darija_ar,"كاين شوية ستريس، كتب شنو مقلقك و رتّب الأولويات."
medium,mixed,"Stress medium، كتب worries ديالك و رتّبهم بهدوء."
low,english,"You seem relaxed. Continue with your routine and enjoy the moment."
low,french,"Vous semblez détendu(e). Continuez votre routine et profitez du moment."
low,arabic,"تبدو مرتاحاً. استمر في روتينك واستمتع باللحظة."
low,darija_lat,"Bayn elik mertah , kemel routine dyalk o stamte3 blweqt dyalk."
low,darija_ar,"باين عليك مرتاح، كمّل الروتين ديالك و استمتع بالوقت."
low,mixed,"Low stress، enjoy اللحظة و كمّل روتينك."
high,english,"Strong stress detected. Place your feet on the ground and breathe slowly for one minute."
high,french,"Stress intense détecté. Posez vos pieds au sol et respirez lentement pendant une minute."
high,arabic,"تم رصد توتر قوي. ضع قدميك على الأرض وتنفس ببطء لمدة دقيقة."
high,darija_lat,"stress qwi , het rejlik flard o tnefess bshwiya lmoda dyal dqiqa 1min."
high,darija_ar,"الستريس قوي، حط رجليك فالأرض و تنفس بشوية لمدة دقيقة."
high,mixed,"High stress، حط رجليك فالأرض و breathe slowly دقيقة."
medium,english,"You are slightly stressed. Change your environment or get some fresh air."
medium,french,"Vous êtes légèrement stressé(e). Changez d'environnement ou prenez l'air."
medium,arabic,"تشعر بتوتر خفيف. غير المكان أو استنشق هواءً نقيًا."
medium,darija_lat,"Kayn stress khfif , bdel ljew shwiya ola khrej shem shwiya dyal lhwa."
medium,darija_ar,"كاين ستريس خفيف، بدّل الجو ولا خرج تشم شوية ديال الهوا."
medium,mixed,"Stress medium، بدّل الجو و خرج شوية للهواء."
low,english,"You feel calm. Take a moment to appreciate this state."
low,french,"Vous vous sentez calme. Prenez un moment pour apprécier هذا الهدوء."
low,arabic,"تشعر بالهدوء. خذ لحظة لتقدير هذا الشعور."
low,darija_lat,"Maendeksh bezef dyal deght , khoud wahd lahda o qeder had lhodoue li fih ."
low,darija_ar,"راك هاني، خد لحظة و قدّر هاد الهدوء."
low,mixed,"Low stress، خد لحظة و appreciate هاد الهدوء."
high,english,"You are under intense pressure. Stop what you're doing and focus on slow breathing."
high,english,"Stress is overwhelming. Give yourself permission to pause and reset."
high,english,"High stress detected. Lower your pace and focus on what you can control."
high,french,"Stress très élevé. Ralentissez et accordez-vous un moment de pause."
high,french,"Vous êtes sous forte pression. Respirez profondément et recentrez-vous."
high,french,"Niveau de stress critique. Prenez soin de vous immédiatement."
high,arabic,"تشعر بضغط شديد. توقف قليلاً وخفف من وتيرتك."
high,arabic,"التوتر مرتفع جداً. خذ استراحة واهتم بنفسك."
high,arabic,"أنت تحت ضغط كبير. ركز على ما يمكنك التحكم فيه."
high,darija_lat,"Stress tal3 bezef, dir pause o nqess men sor3a."
high,darija_ar,"راك مضغوط بزاف، حبّس دابا و ركّز على النفس ديالك."
high,darija_ar,"الستريس طالع بزاف، دير وقفة و نقص من السرعة."
high,darija_ar,"راك معبّي، وقف شوية و رجّع التوازن ديالك."
high,mixed,"High stress! حبّس شوية و breathe بعمق."
high,mixed,"Stress طالع بزاف، pause دابا و رجّع تركيزك."
high,mixed,"Too much stress، حبّس و ركّز على النفس."
medium,english,"You are experiencing moderate stress. Take a short break and reorganize."
medium,english,"Some stress detected. Slow down and manage your priorities."
medium,english,"Moderate stress level. Stay aware and keep balance."
medium,french,"Stress modéré. Organisez vos tâches calmement."
medium,french,"Un certain stress est présent. Prenez une pause courte."
medium,french,"Niveau de stress moyen. Respirez et avancez progressivement."
medium,arabic,"تشعر بتوتر متوسط. رتب مهامك بهدوء."
medium,arabic,"هناك بعض الضغط. خذ استراحة قصيرة."
medium,arabic,"مستوى التوتر متوسط. حاول الحفاظ على التوازن."
medium,darija_ar,"كاين شوية ستريس، رتّب الأمور بشوية."
medium,darija_ar,"الضغط متوسط، دير بريك صغير و كمّل."
medium,darija_ar,"راك مقلق شوية، نقص السرعة و نظّم وقتك."
medium,mixed,"Stress medium، دير pause قصيرة و كمّل بهدوء."
medium,mixed,"Some stress، نظّم وقتك و keep calm."
medium,mixed,"Medium stress، ركّز على الأولويات."
low,english,"You seem calm. Maintain your healthy habits."
low,english,"Low stress detected. Keep doing what works for you."
low,english,"You are relaxed. Enjoy this balance."
low,french,"Stress faible. Continuez vos bonnes habitudes."
low,french,"Vous êtes détendu(e). Profitez de cet équilibre."
low,french,"Niveau de stress bas. Maintenez ce rythme."
low,arabic,"مستوى الضغط منخفض. استمر في عاداتك الجيدة."
low,arabic,"تبدو مرتاحاً. استمتع بهذا التوازن."
low,arabic,"الضغط ضعيف. حافظ على هدوئك."
low,darija_ar,"الستريس ضعيف، كمّل هكا و تهلا فراسك."
low,darija_ar,"راك هاني، حافظ على هاد التوازن."
low,darija_ar,"الأمور مزيانة، كمّل بنفس الوتيرة."
low,mixed,"Low stress، keep it up و حافظ على التوازن."
low,mixed,"All good، continue بنفس الروتين الزوين."
low,mixed,"Relaxed state، enjoy و كمّل هكا."
high,english,"High stress level detected. It is recommended to take a short break, regulate your breathing, and reduce immediate cognitive load."
high,french,"Un niveau de stress élevé a été détecté. Il est recommandé de faire une pause, de réguler la respiration et de réduire la charge mentale."
high,arabic,"تم رصد مستوى توتر مرتفع. يُنصح بأخذ استراحة قصيرة وتنظيم التنفس وتقليل الضغط الذهني."
high,mixed,"High stress detected، من الأفضل دير pause قصيرة و تنظم التنفس ديالك."
medium,english,"Moderate stress observed. Consider organizing tasks, taking brief pauses, and maintaining regular hydration."
medium,french,"Un stress modéré a été observé. Il est conseillé d’organiser les tâches, de prendre des pauses régulières et de bien s’hydrater."
medium,arabic,"تم رصد توتر متوسط. يُنصح بتنظيم المهام وأخذ فترات راحة قصيرة والحفاظ على شرب الماء."
medium,darija_lat,"Kayn stress mtwesset , hawel tnedem(i) khdma dyalk o dir breakat sghar 15min , o shreb(i) lma ."
medium,mixed,"Stress medium، نظم المهام ديالك و دير pauses صغار."
low,english,"Low stress level detected. Continue maintaining healthy routines and regular sleep patterns."
low,french,"Un faible niveau de stress a été détecté. Continuez à maintenir des routines saines et un sommeil régulier."
low,arabic,"تم رصد مستوى توتر منخفض. استمر في الحفاظ على روتين صحي ونوم منتظم."
low,darija_lat,"Stress d3if , hafed ela routine ssihi dyalk o neass lmnedem."
low,mixed,"Low stress، حافظ على routine صحية و نوم منتظم."
high,english,"A high stress level has been identified. It is advisable to pause briefly, slow down breathing, and limit excessive mental effort."
high,french,"Un niveau de stress important a été identifié. Il est conseillé de marquer une pause, ralentir la respiration et limiter la surcharge mentale."
high,arabic,"تم تحديد مستوى مرتفع من التوتر. يُنصح بالتوقف قليلاً، تهدئة التنفس، وتقليل المجهود الذهني."
high,darija_lat,"stress eandek tal3 , dir waqfa sghira , haddi nefsek o nqess men tfkir zayd ."
high,mixed,"High stress detected، دير pause قصيرة و ركّز على التنفس ديالك."
high,qbayla,"Aqerru ameqqran yettwaf. Yelha ad tḥebbes kra n wakud, ad tessekned tifrat n ubreḥ u ad tneqqeḍ leqdic."
medium,english,"A moderate stress level is present. Try prioritizing tasks, taking short breaks, and maintaining a steady rhythm."
medium,french,"Un niveau de stress modéré est présent. Essayez de prioriser les tâches, prendre des pauses courtes et garder un rythme stable."
medium,arabic,"يوجد مستوى توتر متوسط. حاول ترتيب الأولويات، أخذ فترات راحة قصيرة، والحفاظ على إيقاع متوازن."
medium,mixed,"Stress medium، نظم الخدمة ديالك و خدم بشوية بشوية."
medium,qbayla,"Aqerru yella d alemmas. Tzemreḍ ad tesnifeḍ leqdic, ad tḥebbes kra n wakud u ad tkemmleḍ s tazmert."
low,english,"A low stress level has been observed. Continue healthy habits and maintain emotional balance."
low,french,"Un faible niveau de stress a été observé. Continuez à adopter de bonnes habitudes et à maintenir l’équilibre."
low,arabic,"تمت ملاحظة مستوى منخفض من التوتر. استمر في العادات الصحية والحفاظ على التوازن."
